problemE,problemS,answer,winid
"Suppose today is Tuesday and it is day 1. What day of the week will be day 101? Note: Sunday=1, Monday=2, ..., Saturday=7","Supongamos que hoy es martes y es el día 1. ¿Qué día de la semana será el día 101? Nota: Domingo=1, Lunes=2, ..., Sábado=7",5,none
"Among all the multiples of 5 between 201 and 699, how many are divisible by 4?","Entre todos los múltiplos de 5 comprendidos entre 201 y 699, ¿cuántos son divisibles por 4?",24,none
"Ana, Bibiana and Cecilia divide 12 apples. Each one takes at least one. In how many different ways can the distribution be done?","Ana, Bibiana y Cecilia se reparten 12 manzanas. Cada una se lleva por lo menos una. ¿De cuantas maneras distintas se puede hacer el reparto?",55,none
How many two-digit numbers AB (B different from 0) satisfy AB + BA = 88?,¿Cuántos números AB de dos cifras (B diferente de 0) satisfacen AB + BA = 88?,7,none
"Six children take 16 sweets. Angela takes one candy, Andrea takes two and Vanesa takes three. Carlos Gil takes as much candy as his sister, Pedro Perez takes twice as much as his sister, and Ramon Martinez takes three times as much as his sister. What is Angela's last name?","Seis niños toman 16 dulces. Angela toma un dulce, Andrea toma dos y Vanesa toma tres. Carlos Gil toma tantos dulces como su hermana, Pedro Perez toma el doble de su hermana y Ramon Martinez el triple de su hermana. ¿Cual es el apellido de Angela?",Martinez,none
"The average of a set of 10 numbers is 20. If one of the numbers is removed from the set, the average of the remaining numbers is 19. What number was removed?","El promedio de un conjunto de 10 números es 20. Si uno de los números se remueve del conjunto, el promedio de los números restantes es 19. ¿Qué número fue removido?",29,none
